semantic_layer,panel,privsaf_only_method,privsaf_only_AUPRC,router_selected_method,router_selected_AUPRC,best_incompatible_or_oracle_method,best_incompatible_or_oracle_AUPRC,evidence_file,interpretation
native_flatline_windows,public raw-stream flatline mining,privsaf_hmm_scan,0.4839270719600141,privsaf_hmm_scan,0.4839270719600141,identity_channel_hmm_scan,0.5046892119913821,results/icde_native_weaklabel_summary.csv,strict same-bin native flatline windows are the closest real flatline layer.
field_qc_stuck_labels,I-ORS deployed rangefinder,privsaf_hmm_global,0.3720718576902568,pm_window_glr,0.7164217761060185,not_reported,,results/iors_stuck_qc_pmldp_summary.csv,field QC labels contain local regime evidence beyond one global stuck bucket.
field_qc_low_epsilon_0.5,I-ORS deployed rangefinder,privsaf_hmm_global,0.2121288811899037,pm_llr_cusum,0.3889657682117522,not_reported,,results/iors_stuck_qc_loweps_pmldp_by_epsilon.csv,low privacy budgets favor cumulative local evidence.
field_qc_low_epsilon_1,I-ORS deployed rangefinder,privsaf_hmm_global,0.3316148746903786,pm_llr_cusum,0.5161377190365313,not_reported,,results/iors_stuck_qc_loweps_pmldp_by_epsilon.csv,low privacy budgets favor cumulative local evidence.
explicit_availability_dropout,I-ORS deployed rangefinder,privsaf_dropout_hmm,0.9999854468556691,privsaf_dropout_hmm,0.9999854468556691,not_reported,,results/iors_dropout_qc_pmldp_summary.csv,explicit missing symbols use the dropout emission operator.
prepared_multivariate_stuck_labels,WSN prepared stuck-at benchmark,privsaf_hmm,0.2961059052584245,pm_window_glr,0.4626246569610647,not_reported,,results/wsn_stuck_labeled_pmldp_summary.csv,row-level prepared labels mix several scalar features.
real_station_straight_string,HadISD station 702606-96401 plus compact and cross-page screens,privsaf_hmm,0.895819053200694,privsaf_hmm,0.895819053200694,not_reported,,results/hadisd_multistation_streak_pmldp_rollup.csv,RSS/WSS wind strings give the strongest PrivSAF-HMM real-streak evidence; page-7 and page-0 screens add 58 TSS/DSS cases where page 0 roughly doubles AUPRC over prevalence but PSS has no support.
official_flat_tolerance_labels,NOAA CO-OPS verified six-minute water level,privsaf_range_hmm_r1_fixed_prior,0.0245505827612148,privsaf_range_hmm_r1_fixed_prior,0.0245505827612148,raw_zero_slope_radius2,0.8743775392237314,results/coops_verified_flat_full_protocol_summary.csv,official verified F=1 flat-tolerance labels preserve WL_VALUE in the same ERDDAP rows; the frozen all-eligible KRR-LDP protocol uses prior-month calibration only and selects the range-HMM above channel_window_glr_5 on the full panel; raw flatness upper bound AUPRC is 0.874.
